{
  "schemaVersion": 1,
  "name": "coakka-runtime-addon-artifact-publisher-sftp-native",
  "addonId": "coakka.artifact.publisher.sftp",
  "version": "1.2.0",
  "release": "1.2.0+00000000",
  "sourceSnapshot": "0000000",
  "archive": "coakka-runtime-addon-artifact-publisher-sftp-native-1.2.0.tar.gz",
  "sha256": "0000000000000000000000000000000000000000000000000000000000000000",
  "runtimeCompatibility": {
    "abiMajor": 2,
    "minimumNativeVersion": "2.3.0",
    "requiredFeatures": ["file_lane"]
  },
  "ownedStaticDependencies": [
    { "name": "libssh2", "version": "1.11.1" },
    { "name": "OpenSSL crypto (macOS static)", "version": "3.6.2" },
    { "name": "OpenSSL crypto (Ubuntu Linux static)", "version": "3.5.5-1ubuntu3.3" },
    { "name": "zlib (Ubuntu Linux static)", "version": "1:1.3.dfsg+really1.3.1-1ubuntu3" },
    { "name": "jitterentropy (Ubuntu Linux static)", "version": "3.6.3-1" },
    { "name": "zstd (Ubuntu Linux static)", "version": "1.5.7+dfsg-3" }
  ],
  "userInstalledNativeDependencies": false,
  "cmakeConfig": "cmake/CoAkkaRuntimeAddonArtifactPublisherSftpConfig.cmake",
  "headers": [
    "include/coakka/addons/artifact_publisher_sftp.h"
  ],
  "exportedSymbols": [
    "coakka_sftp_publisher_cancel",
    "coakka_sftp_publisher_create",
    "coakka_sftp_publisher_dependency_version",
    "coakka_sftp_publisher_destroy",
    "coakka_sftp_publisher_forget",
    "coakka_sftp_publisher_get",
    "coakka_sftp_publisher_get_target",
    "coakka_sftp_publisher_start",
    "coakka_sftp_publisher_stop",
    "coakka_sftp_publisher_submit",
    "coakka_sftp_publisher_wait"
  ],
  "platforms": [
    {
      "id": "linux-aarch64",
      "library": "native/linux-aarch64/libcoakka_addon_artifact_publisher_sftp.so",
      "loaderLibrary": "native/linux-aarch64/libcoakka_addon_artifact_publisher_sftp.so.0",
      "matchingHostRuntimeTest": "passed",
      "dynamicDependencyAudit": "passed"
    },
    {
      "id": "linux-x86_64",
      "library": "native/linux-x86_64/libcoakka_addon_artifact_publisher_sftp.so",
      "loaderLibrary": "native/linux-x86_64/libcoakka_addon_artifact_publisher_sftp.so.0",
      "matchingHostRuntimeTest": "passed",
      "dynamicDependencyAudit": "passed"
    },
    {
      "id": "macos-aarch64",
      "library": "native/macos-aarch64/libcoakka_addon_artifact_publisher_sftp.dylib",
      "loaderLibrary": "native/macos-aarch64/libcoakka_addon_artifact_publisher_sftp.0.dylib",
      "matchingHostRuntimeTest": "passed",
      "dynamicDependencyAudit": "passed"
    },
    {
      "id": "windows-aarch64",
      "library": "native/windows-aarch64/libcoakka_addon_artifact_publisher_sftp.dll",
      "importLibrary": "native/windows-aarch64/coakka_addon_artifact_publisher_sftp.lib",
      "matchingHostRuntimeTest": "passed",
      "dynamicDependencyAudit": "passed"
    },
    {
      "id": "windows-x86_64",
      "library": "native/windows-x86_64/libcoakka_addon_artifact_publisher_sftp.dll",
      "importLibrary": "native/windows-x86_64/coakka_addon_artifact_publisher_sftp.lib",
      "matchingHostRuntimeTest": "passed",
      "dynamicDependencyAudit": "passed"
    }
  ]
}
